{
  "schemaVersion": "1.2",
  "submissionUUID": "11111111-2222-3333-4444-555555555555",
  "taxRegistrationNumber": "5001636863",
  "submissionTimeStamp": "2026-01-01T10:00:00Z",
  "softwareInfo": {
    "softwareInfoDetail": {
      "productId": "Meu ERP CERTO",
      "productVersion": "1.0.1",
      "softwareValidationNumber": "C_134"
    },
    "jwsSoftwareSignature": "<JWS_RS256_DO_SOFTWARE>"
  },
  "jwsSignature": "<JWS_RS256_DA_REQUISICAO>"
}
